{
  "schema_version": "transfer-package-1",
  "transfer_uuid": "44444444-4444-4444-8444-444444444444",
  "source_case_uuid": "11111111-1111-4111-8111-111111111111",
  "created_at_utc": "2026-07-17T00:00:00Z",
  "destination": "Partner Lab A",
  "purpose": "Technical review of selected bookmarks",
  "authority_note": "Approved by case owner under local SOP",
  "selected_bookmark_digests": [
    "aaaaaaaaaaaaaaaaaaaaaaaaaaaaaaaaaaaaaaaaaaaaaaaaaaaaaaaaaaaaaaaa"
  ],
  "result": "export_ready",
  "signature": {
    "algorithm": "Ed25519",
    "key_id": "lab-local-1",
    "payload_digest": "bbbbbbbbbbbbbbbbbbbbbbbbbbbbbbbbbbbbbbbbbbbbbbbbbbbbbbbbbbbbbbbb",
    "signature": "DEADBEEF",
    "trust_state": "VALID_UNTRUSTED"
  }
}
